text,class
去年6个点，今年疫情开始就是4的的随意利率。好像用有的的直接能批，不像建行快贷容易套路。在一年中良心支用，最好支地方是就在有效期一年内个点最后一天房贷中行，都还...,1
我11月份申请的现在还没有提过，恶心,0
说明资历还是不错或者说的,1
已经卡联系我兴奋了，开心,1
一个多月恭喜恭喜！??我激活一年了，还没首提聚润了用！??你总共有几行卡啊？招商每个月剩多少在卡里呢,1
查不到。我在银行app里面查不到，打银行电话说也没记录。还没提交上去都半个月了，这个兴业的好坑啊,0
没有的话，提示让你去网点申请。网点申请额度也高，速度也快,2
我特进了一大堆没的，了个鸟白……现在??我能给干到8W?能过就行了吧。。。,0
交通银行也是国有大银行，不能说野鸡,0
呢权益是越来越少啊,0
老哥，打客服问问具体卡在哪没能一步了，等的好焦躁啊,0
酣畅淋漓一气呵成呀！恭喜，申卡都这样才好，要么阻，要么秒批核卡。,1
送了了个人头了卡盼了多少个日夜，第一次成功破1w，欣喜若狂，值了值多少，终于不是烂卡了。成功升级小菜，。,1
还傻傻的养农业银行流水,0
我工商信用卡也忽然封卡不让用，我用了一个星期解开，很简单，你按照我说的操作就行，先给客服打电话然后投...,2
你是哪里申请，去淄博激活的？,2
要不是民生耐操，我也Pleyben了，怎着刷甚至没电话来。分不值钱，不提额，也就这样了,0
我批了，利息高，用不起。,0
我什么都没有，所以我感觉信用卡无望,2
过了再说吧，额度靠后,2
看了你发帖大概率要套路。。,0
我的工商这几天也不更新了。,2
运气真好，银联是1999的,1
恭喜恭喜？白金了么！,1
不对，虽然是原路退回卡里，但我办分期已经把消费的那部分占用了额度，分期后相当于这部分已经等同于还款了，退回去的已经是超过额度的钱了，我以前试过类似情况，当时是...,2
我办的也是招行的信用卡，我个人觉得最大的啊就是给男朋友优点。我平时拿积分去换换咖啡啊和我去看看电影省钱，感觉挺不错的,1
交行超级野鸡，记仇行就是这样，不要也罢,0
我在学校办的Nagapattinam5000，工作后更新信息直接1.5w，工作半年要涨1.9w了，临额4.5w，可我还是觉得好慢[捂脸],0
我也是，前天收到微信授权说可以提，但是昨天看他们的提了，我也没提看样子这次阿又了,0
这个有名额，要靠抢，时常刷新看看。掌上生活盯着,2
正常吧，离职率高不就得经常招人,2
网贷是坚决不能碰的呀···,2
爱几把就降，不敢用了，惹不起，还不如好好养招商,0
哦哦那就好，6+1是第六个月出账单的第二天吗,2
你激活的是认真的。微信微信官方账号必须有3次激活。,2
九万九变成一万九？太坑了吧,0
不是到账吧，就是固定额度，圆梦斤这些每位月在扣，你明天再问问，既然收了圆梦金的利息，凭什么不声不响就收回,0
你是跟银行协商无果以后投诉的还是直接投诉的？该金融机构咋说呀？,0
好提，半年就有惊喜,1
我其他手机卡都除了完了，就是兴业的除了了除了没多少，利息疯长啊，我说分期最低还款，也反向给我据了,0
开卡就要收取这笔费用，我这几年开了多少，在有这个app之前，还真没有注意到这一点，我简直要疯了,0
我大白金7w，前两年办了百夫长没激活降到5w，今年办了好车主金卡，又被降到是3.9,2
微粒贷，借呗，这些也是多头的因素。因为这些都上征信。我两行卡，都是多头。因为我也是有使用微粒贷，花呗，借呗，白条。查征信显示这些全部上征信了。...,2
拙见：喜欢额度，留额度前四名或前五名即可,2
14年质押10k首卡建行8k(已销卡),2
申请的时候也没让提供信息，真烦,0
用了几年了，一万，还不让提额,0
云闪付还款啊，0手续费还秒到,2
错过了，以后也不会批准，放弃,0
如果逾期时间较长，逾期金额较为明显，就是把你加入银行黑名单，从此再也不能申请建行银行卡。,0
外催的吧，态度恶劣,0
申请单号没啥用，不是工商银行的，都查不到,2
老朋友你这十个500是什么时候什么时候的？当我发现的时候，心累么,0
你怎么知道。8月份借了一次1w？有什么事问题吗,2
季日均一个月，这砖一个月就行了，开心，哈哈哈,1
两个月银行就会主动联系你了，但是本金要大于2万,2
铁公鸡介科羽这波操作，主要就是敲山震虎！,0
你是逾期协商每个？我没逾期黑屋但进，，了不让分期，还是的只能够还最低，利息1000左右，坑的不要不要的。想协商给与分期啊。有没有成功月大神指点一二？...,0
广发！提的快额度,1
谢谢您的回复，距离最后一次取款已经3个澄清月了。?大概是翻车了,0
办下来是菜卡，卡多不好养！请问中信刷卡姿势？谢谢,0
从批卡到开卡首刷然后第三天显示达标，至少要四五天，时有没有就不一定不过这个活动时间还很长，还有小半年，就算没有大概率会补货…心累吧,0
招商银行换我黑房子5年了他废我还怕他？？！,0
一开始就先金卡普卡开个口子先,2
必须注销看不起谁呢,0
"能刷就好了,分都是佛系",2
恭喜楼主，这马先生幅度，摩拜！,1
大妈小昭抵押贷款方便！中行活动划算,1
现在给我两条路，一条一次性，半年还清，13万哪个我也做不到，现在还冻着我银行卡，生活都困难了...,0
结清后停一个月，继续开整，持续三月累计消耗额度230%；累计400笔,2
我看到过一个案例啊。也他们是逾期很久直到被卡中起诉了，银行也不敢动他储蓄卡里面的钱。几万元最后法院判了用储蓄卡里面的钱一条强制还一部分，留一部分生活用。...,0
用卡两个月没什么吗，真的是有点慢啊,0
逾期时间较长，逾期较大，就是把你银行黑名单，从此再也不能申请建行。,0
广发现在提额也慢了，2年没提额了,0
看来冷冻对民生还是用有点的,0
了给拉黑了怎么办？？一毛都转不出啊,0
广州这边也是这样的，理财经理见不到100砖就跟你讲星星，要是爱车看到有100砖了就像舔狗一样您立马把你当譬如大爷伺候着！,0
怎么刷到五星？申卡每次都被拒,0
老油子都消了，无所谓资质好不用消也能过,2
亏死了，撸一万就要60手续费,2
招商银行换黑房子5年了?他废我还怕？？！,0
看完心理平衡多了。。卡将。我只有流水卡中，预审批没有，始终下不来卡,0
羊卡吧，不错卡还是young的,1
余款招商银行信用卡动不动就打电话分期，真烦,0
异地前缀激活了，尽兴,1
申请别的会直接拒不！我也是19年下卡0额度！很惨！,0
活动说明不是写的50-1000元么？你怎么还抽到25的。。。太坑人了,0
5行内要申请建设啊以后很难很难批卡,0
啥卡要行驶证啊，车主卡吧,2
闪付应该不算第三方吧，就是小额双免，1000以下不用输密码的那种，0.38的这个，也不能累积里程了吗？,2
我特扣没逾期都频繁提示就是并么了违约金。而且还款记录逾期按时还款的,0
我也看到哈哈哈，然后又补刷了一千，了，开心的,1
如果你资金紧张，设置分期肯定划算，客服打电话给我,2
投诉，想用银行天天给我打电话，我想骂人,0
就是也。死不承认。很明显的页面金额都不是。又凭什么说可用是对的？我还说是额度还在。没收回收回对的呢。客服系统故障统一看着都念的。他们自己后台糊里糊涂。昨天客服...,0
我丢，金融件又还敢扔快递柜？除了京东自营与顺丰真的，我的快递扔掉都被扔各网点，但金融件没遇到过，上行通过京东不怎么派…邮政储蓄太不靠谱了吧,0
，说现在情况特殊，没有办法全额还贷！我已经提供了疾病证明,2
我说的是国外都去了来几个真实消费提额会快很多,2
网申c都了1.8W。连买个全幅单反标白下用不了…服了…,0
是不是可以销卡了,2
好吧，反正都是提不了哈哈哈，放弃吧,2
正因为走了许多路，经历的无数繁华与苍凉，我们才能在时光的流逝中体会岁月的变迁，越来越了，可能是老...,0
没能牛二个月没有了，心累啊,0
听说美团卡在征信上不显示，工作地，居住地都在010，现在在河北老家，如何,2
我还款日后第四天还的款，今天又出了临额和e招贷,2
去申请了借呗，花呗金条，白条，分期乐啥的都借过，征信应该很花，没有逾期记录保持的很好,1
反正中信的扣款你永远看不懂反正！,0
我的提了，2个年了都，平安还是挺快的,1
弊端就是持卡人都有年费的，基本上都是刷刷六次就可以免次年年费，而且也不限金额。,0
四千因为没什么用，销了也好！注销了没啥可操心的了,0
不到3W就会消失???太坑了,0
主要是你太优秀了，人工审批的那个哥们银行帐户还是妹子了为看你不顺眼有点！你这么好的资质申请个毛的信用卡！所以拒绝你了,0
麻蛋。。我也秒我了。拒得打电话问问:'(,0
平安的备用金太坑别用，了我提前还了扣了3%，打电话怼回来了,0
找不到，没有具体的，完全乱了,2
同黑不能分期没临时,2
申请的时候也没让提供方便这些信息啊，真烦,0
提前恭祝楼主下卡，下来了，通知一下，我呢好看看有没有水，好嘛,1
楼主直接投诉到银监会别民生扯皮,0
代发就能过啊？那说明是资质不错的，一般银行都会批信用卡的,1
我现在想汇款再转账办一些其它行的银行卡，忌讳多头授信，而且信用卡太多，银行每年都查我征信，过几年以后可能还数年需要办银行贷款。,0
马上会收到了新卡片，正准备激活，测出我这个破信用卡，竟然是每年2500元年费的白金卡，omg!,0
结算卡有流水，是好事啊。应该是多头授信吧,2
那么利息低，牛皮,1
安全激活非常简单。也可以郑州去。交通便利?在郑州,1
建行5万后很难提额了，出临时有什么意义，和固定没什么关系,0
农行7k-100元,2
笔数太低，进没能小黑屋了,0
没写啥原因就写的疫情原因和个人原因，具体没详细，然后他们就来打电话协商了，协商还是很好的,2
够呛能提，少提点也可以啊,2
你到底提没提？我的浦发的提了,2
这不是浪费时间吗?征信不好?天啊的?白天要休息,0
这个不算什么，收款我经常被交通银行客服电话轰炸,0
账单周期都是刷掉总额的80％，提额很快。,1
提前恭祝楼主下卡，下来了，通知一下，我糟看看有没有水，好嘛,1
银行现在我两条路，还清一条半年还清，13万，哪个我做不到，现在还冻着我名下银行卡，生活都了...,0
民生很看重实在太地区，有点看不起农村人哈,0
没告你，，我还欠几万。天天说要报案起诉，太坑了,0
平安不支持跨行自动还款啊，这个不方便,0
我去年拒绝了今年也没敢核准,0
请问每个月大概会用掉额度多少比例呀,2
我可以很负责任的告诉你，那是假的！再没钱也要每个月还百八十就可以了！,2
我哭了，居然要这么久，其他都是半年久开始了，第一次搞四大行竟然这么慢,0
新卡，不过你自己带Daikokuya就好了。?,2
你这，难。。养养再吧,0
然而我的30K还在精养。。我的工行啊,2
三天能进入的审核流程就不错了,1
如果秒批了我猜他额度肯定是共享了，可他现在没秒批而是审核了两天，估计能曲线！,2
真有钱，这有钱还办什么信用卡,2
现在就怕申请不下来，好多人说我三月份同一天网申七八家信用卡都被拒绝了要过半年在申请，是这样么,2
寄出来还可以改？我觉得不行吧,2
好略德，半年就有惊喜,1
我3000-10000-18000-24000，这是我的额度提升过程,2
试试，如果在降低就办法了，,0
是漏被小黑屋还是怎么滴了？搞得我现在都不想刷建行的卡了,0
资质可以了，你这次申请提交的什么资料？,2
我的建行白金才2W,0
以前的招商很好提早先，现在没有那么好提了，当初下卡8000,1
80存了多久才申的呀？,2
的时候可以加到手机闪付里，3.8。,2
这个卡我申请也是扣了我50大洋啊。银行小气,2
减少使用额度，额度是银行的。,2
话说调额这一步，打电话给客服让客服调不知道行不行，或者申请二卡的方式,2
，整个授信政策厌恶多头授信建行授信规则要求拒绝多头,0
一般都是几天审核秒批秒拒的。,2
不要听那些一个月交100元以上的，完全没用。还不如,2
卡员上门拍照你咋过的啊哎？好心慌,0
还可以人工重申，学习了，太棒了,2
一个月左右，时间有点幸呀,0
我理解楼主大妈这样无任何逾期负债么当初根本就任何负债个人就有三卡只是大妈那张额度不高就偶尔网购没有刷过任何机器结果隔几个月就现在1...,0
正仍在因为走了许多路，经历的无数繁华与总而言之苍凉与此相反，我们才能在时光的流逝中体会岁月的变迁，越来越怀旧了，可能是老...,0
什么基金，情况大震荡,0
交行超级作弄，野鸡行就是这样，不要也罢,0
恭喜恭喜，小招终究是想起你了！,1
傻吧，月4那要乘以2。,0
感觉套路了啊。第三方销售一样,0
之前申请过建行5K用了一年消卡现在新单位组织办公务卡又是卡被拒,0
哈哈！之前的情况是每次去网点办业务，都要被推荐办个储蓄卡，几年下来一大把储蓄卡，想注销还被劝不要注销……,2
利率不错汇率，可以撸,1
我下卡5千，五年多了，没有动静这个额度也是没谁了,0
招行还是支付宝最稳，动物都没他可信赖，天书太牛逼了,1
工行卡可以的，卡好养,1
建行没戏了已经。士嘉堡上渺茫,0
外催急的吧，态度恶劣,0
我基本不去夫基征信，很久以前夫基过三次，看到2015年还是多久的网商贷记录还有，妈的贷款几十块几百块记录一大堆，我都惊诧了。应该是没有什么小贷的，只碰过京东啊借呗网商...,0
亲，协商好了说一下，我情况和你差不多,2
你居然信它家，要笑死了哈哈哈哈哈。还不如多搞搞工行，建行的境外返现呢……,2
这么优秀,1
招商银行信用卡很甚佳，给我批6千额度，一直获升到目前的6万。,1
不是，吧扣款就是固定额度，问问斤这些每个月在，扣你明天再圆梦，既然收了圆梦金的利息，凭什么不声不响就收回,0
上海信访写信投诉，过两天就会有工作人员介入你要说你的情况，之后招商的就会联系你协商让你撤诉。,0
我也是晚间申请下午来短信通过，也是b卡中，不过我的额度没你高。恭喜了,1
失望就注销，外资银行银行看不起人，踏马的,0
最低的话，每个月税金不低啊。,0
线下应该大部分商户都没积分了吧,2
时间很低了，民生效率长,0
你点加速回答自己填的信息。,2
难道银行接通车管所平台了吗？不可能吧,2
额，我卡里1198啊，不多,2
消卡消户，免得产生年费！什么通过入去刷卡覆盖不良，明坑小白刷卡费，记录是无法掩盖的，只有还清后5年才能在征信上去这不良的！...,0
余额宝里一丢，安全又稳定,2
中信一般不收，但是正在起诉，不过你可以帮忙,2
不在也不提，去注销了吧,0
2012年的二代盾一直用到去年才换成蓝牙盾的,2
广发卡一年二正常用没月平均四五千，额度四万了，一年都每个提额显示不符合条件为啥,0
额度很优秀，不错。都再申请，兴业和华夏如果不错,1
不懂他们打过来是干嘛郁闷的，气愤,0
问题是怎么解决5万以上的后续问题呢？达不到10万都是弟弟，至少工商有大概率可以获得...10万的，建设的话多，大白山有点累万...,0
刚从营业厅回来补了一份身份证，希望可以顺利把卡办下来,2
楼主什么时候完成任务的？现在，我的到了。难过啊,1
隔天才可以看??不过款是扣了。兴业要不要这么坑,0
一去年都不用。兴业就这样的,2
你是跟地方银行协商无果以后投诉的还是直接投诉的？该咋说呀？,0
不知道，工行5000和建行14000已经一年多了。,2
工行现在的分期电话也是比较频繁的，拒绝就是，如果折扣大可以考虑,2
开卡就要收取这笔费用，我这几年开了之前张卡，在有这个app多少，还真没有要这我，一点简直注意到疯了,0
正常现象，白金以下复习大概4周，加上元旦，3号申请8号领,2
再申个试试.我再以申请了招行的星座卡不错哦,1
除了额度原因，招行能够通过现金分期实现快速提额毕业，也比较适合入门级卡友,2
银行没收了。工作人员当做辛苦费了你要不回来了，强行要你吃国家饭，坑不坑,0
申了两张卡，一张过了，一张审批。请问第二张直接,2
我也通过了。等插座激活后，我申请了一份工作。,2
我明白了，全额还完之后无息刷出来就太好了。如果刷卡手续费,1
中信最垃圾，申报银行帐户，打了两次回访，现在还在审核中，真恶心,0
面签，7号业务员来公司办理然后一直没更新。这可咋办呀，坑死了,0
你好，逾期这么久没有起诉吗？我也是招商逾期，本金加信用卡二十几万,0
去百度地图上搜索中国人民银行，每个地方都有央行，小县城都有，然后去那打印就可以了,2
大美青海信用卡??只有一个账户?必须?你可以去了解一下换钞??权益不错可??金卡5次免??白金15次或5000免,1
下卡了，我浦发的早下来了,2
我的建行才白金2W,0
你欠不欠？我欠11万。打电话给我，告诉我过两日给我，现在催款总是喜欢勒索,0
电话上乃是有说什么就是指费率吗？我感觉是稳的，这个卡办下来是当从你在帮银行的忙，银行在求你办呢,1
多昨天申请不好已经拒了。如果负债高，查询多信用卡账户也我，就不要去碰瓷了。我打电话问的。这又，资质好的秒过，一直的的别去尝试，了额。玩意特么浪费一次查询...,0
这个，就是每天一个电话招商烦。,0
不知道你有没有真正消费过。,2
靠，白金卡还有这福利？我特么金卡就只有一句恭喜发财，晚知道办个白金了,0
很久以前开了个金卡，没啥卵用很久没用了，昨天突然想起拿来收200多,0
了让确定，之前用过，还打电话给我妳索要，我说过几天给，然后没后续了，银行坑不坑,0
秒拒??征信太花了，三个月五十条查询,2
这么惨的嘛，一直都批的额度很低,0
麻蛋。。我也秒拒再说了。我得打电话问问:'(,0
最近一直游过来游过去。是在吊我吧，浦发,2
激动，刚秒批了菜金卡5k！我刚看了手机银行预审批2.6w去申请了两秒秒过马上1.3已经到卡了，2年前卢吉夫交通3.6逾期！去年也当年申请过卡秒拒...,1
楼主，从哪里申请的？这个资金规模喜人啊,1
从没被邀请的路过，拔凉拔凉的心,0
今天去体验了一把洗牙服务。真不错。,1
捷贷知道12万网我目前逾期，打总行说问放款行，打放款行他们也不的，太特么难了，,0
牛逼，白金100.然后年费几百我要是，直接拿刀去民生银行了。耍猴？,0
另外一个可选择的：广发白金，额度高，权益好。活动期内不用刷，绑定vx，zfb即可免年费。,1
平安储蓄卡和都建议你信用卡办，活动蛮多,1
其他野鸡粘冠行全已销户,0
那他就多收你几个月的利息？逾期罚息你减不了,2
账单日和还款日一定要记住，按时还款，不要逾期，逾期会上征信,2
办电子货币，除了四大国有银行（中国银行、工商银行、招商银行、建设银行），平安银行和招商银行也不错。,1
这种破也罢，见鬼的中信,0
能啊，上次9月我还调平过。,2
相比之下大山白的年费就多了，刷来刷去都,0
招个黑房子概括的太高真胃痛恶心,0
太直接了，给农行点赞,1
一扣款就拿临时性说事。好几次了。客服也是每次确实这么说。就说给我临时性了。浦发的政策有点恶心,0
2019卡3万元，2020年12月注销，2021年12月注销,2
感觉基本都是随便下卡，只要征信没问题，有个稳定工作就能下卡。具体的看申请吧，不试试怎么知道，试一下热门卡片，不行就隔等以后再尝试，不建议那种不下卡就短时间内频繁...,2
别急呀，民生，很慢的我的卡的第几天都没发出去？,0
你是那里的，我湖北的，浦发卡很容易批呀,2
各位以后切记不要尝试咯，花费几百没有，还是按照银行的要求来吧，这样被坑,0
我没招商银行写错，你也没看错。我在它行都是十几二十万的额度存款利率，利率不过4点几。伤害性不大，侮辱性极强很小，交行净干这得罪顾客的事。,0
牛逼还是支付宝最稳，动物都没他靠谱，天书太招行了,1
民生还是很不易提的，多刷就能提，风控也松,1
我然后最后，一次性还款只肯减免违约金3600，利息差不多20000电话不少投诉我没同意。昨天。了，今天来一分要我撤诉，担心他跟总行那边申请减免。我就也是还是不给减免，...,0
广州这边也是这样的，理财经理见不到100砖就跟你讲星星，要是看到有100砖了就像舔狗一样立马把你当大爷着,0
是在我看来的，老农那套系统，比较恶心，学学人家浦发,0
悲剧了，优惠出来了，结果不支持信用卡支付:o,0
最后是怎么处理的？我逾期六个月，利息一万多,2
你是相对较低来显摆的吗，没长卡额度都这么高,0
工商银行的霸王条款，自主占用不会说明但是申请个，出现的，办理分期付款后，利息12后月也好，24个月也好会从个月也好，会一次性36额度中办理扣除，太黑了！,0
有点影响吧无所谓了装修钱不够,2
我现在招商信用卡逾期七万多，一年多了，都半年没接电话了，不知道接下来怎么样,0
你对砖行深情义气，但砖行对你不厚道，又不好买回,0
上班地方有，直接叫卡员过来，比较快。,1
月月刷干月月还两年多了从来不给提重新安排都不给，抠死了浦发,0
收到卡。测试有望在下个月底揭晓答案，好期待我的交通银行卡哦,2
工商银行的信用卡是经典信用卡当中的常青树，在工行区的讨论热度也是BeauvoisinTOP1。,1
前几天从3提到3.6，这个利率有点高啊,2
要提供工作提供服务证明吗老哥，好焦虑,0
日常生活吃饭、看电影啊还是招行好，不过建行车卡、航空卡还可以,1
确实都是本地网点的让办理打来，本地网点还是靠谱,1
征信查询太多影响下卡。招行资产放上半年以上找理财经理,2
这额度用来买菜吗,0
我也打算过几天申请，万一哪天门槛越来越高不给办就亏了,2
金额咳咳，额度太低了,0
最近又申请成功了工行香格里拉白,2
伪白金卡,2
今天刚给我打了要我分期，7000多账单让我分24期，说是有费率优惠，我说才几千块还有分两年那我还不如不用拉呢，巴拉巴拉了半天，给我办了6期...,0
你可以说一下有哪些行的卡，额度是多少，然后销掉一些，最后去建行网点重新办理一张信用卡。,2
消卡消户，千万别产生年费！别信什么通过算账入去刷卡覆盖不良记录这套，明坑小白刷卡费，信用记录是无法掩盖的，只有还清后5年才能在信用上抺去这不良记录的！...,0
建行四大行之一，龙头企业，银行界的翘楚，不可或缺所以建行在积分兑换这块，特别是在我觉得还不算吝啬,1
直接刷爆，最后提了8k。。。兴业的就这么操作,2
这个我就不清楚了，我没这方面经验。我做的这些准备都是根据坛子里老哥们的经验分享结合自己实际情况做的，有网贷如果征信上能查到，最少算减分项，这种情况还好，就怕建...,2
招行做确实比那些带中国的好不少,0
中行的房贷，e贷秒通过，20万额度,2
中信确实差，国人都知道，都谁用谁堵心,0
我吧都是一万.我下了8000帮有一起骂小字我的也没到，坑不坑,0
谢谢您的推荐和申明，昨晚接到交通银行信用卡信息中心邀请我办，我问了优逸白金信用卡，客服说魔都优逸白金信用卡我的情况下卡比较好,1
我的菜卡红字还提额了,0
民生就是提额幅度不爱刷，我都太小了,0
貌似即使不满足要求信誉度最撇也会保持在4星？应该是的，工商的星际就保持的不错,1
2500，这额度有点低,0
万28花4.5微博，,1
已经成功一千万，额度10万,1
我是通过邮政申请公积金贷款的。反正我去年交了15个公积金,2
这卡是单币卡吧，头疼我的星座卡，一堆账户，看着不爽,0
白金哪个行给我六万多的额度真的立马注销。伤害不大，侮辱性很强。,0
这都要拒，贱行真是个奇葩行,0
