text,class
感觉玩法了啊。第三方销售一样,0
这实体卡卡当年创了新,2
你放心，会你办公室，你让业务员过来还是，然后业务员就不去去的，毕竟他是有钱哪里的，拿很开心的,1
只要不逾期强迫症账号多少没有这个影响，只是对于，来说，一个人不喜欢逻辑太多卡，否则手机申请的应用太多，用招商银行交账号不好。按照任何下面，钱，,0
atm别用，真坑,0
我是今天第一天！以前跟！分期都是95559电话我今天这电话让诈骗号似的，还一会儿一变！,0
民生只能等系统自动提了了白费力气别,0
光大是我销户的下一个目标，积分也废了，用了快两年了。,0
老哥，我的这张卡也通过了，在工银e生活数字卡专区直接激活了,2
中信银行的送礼速度要，最早也很慢2个多月。,0
多消费，多刷卡，多参与线下实体店消费，招行特别喜欢刷卡笔数，绑定支付宝，微信线下线上刷，每个月刷卡25笔以上,2
我傻逼的打过去想解除譬如风控！,0
二卡申请，应该也是共享额度吧,2
优惠这方面，经常（不错的。以前搞“周三便利店五折”活动的时候趁小招周三去711薅薅招行5折优惠一直每单5元封顶），每月可以便利店两次。...,1
不同意不够银行都这样，伤心,0
可圈可点了，说我额度使用率低不给我提捏！我看别人十天几块钱的消费不照样提,1
目前就觉得招行福利挺好，但是建设银行JOY信用卡,1
基本上无缘了，以后都不批不要更，提额度啥的,0
不好意思，没看嘿嘿你前面的逾期时间，楼主千万别轻生，你想想啊，只要你人在，就有希望假如，前面赚钱还啊，我朋友生意失败，银行贷款2.3中间百万还不上，家里房子都卖了，也不够还的，还中间...,0
别来这造谣了。你妳这图根本看不出一卡二卡,0
两种，一种是消费服务能消费三笔，年费会员，前八万名，另可说是一种消费2w，社团前两万名，都可以领年费会员，也就是说可以刷两年的会员出来，另外强烈推荐招行的哔哩哔哩联名卡扣，好看太多了，建行app简直是灾难,0
平安不能碰,0
业务员上门来办理的，非常营业员方便,1
就有卡通道直接申请，没提交其它材料,2
建言查征信报告，你可能会有惊喜，,1
那的网上申请，激活我时候还是要被刁难。这也太离谱了。,0
这卡有什么用感觉，没用,0
看你签名，感觉可能是其他行授信过高,2
信用卡被盗借记卡刷一次你就会恨死工行,0
建行知音白金卡是坑兑换不建议办，网上消费的积分是白，没啥里程的。大山不能不能兑换航空里程，航空用。,0
查到了，显示录入，开心,1
我也看到了，然后又补刷了一千，哈哈，开心的,1
去年我也搞过一次。新快现。需要消费凭证或者发票。我没有理会。,2
老哥不错??我是看来无望提额了,0
广州这边也是这样的，理财经理见不到100砖就跟你讲星星，要是看到有100砖了就像舔狗一样立马把你当大爷伺候...,0
准备打。今次投诉定了。大家竭尽所能。虽然最后不知道怎么样，但是合理地维护自己的知情权还是要必须要的。,0
要不是额度高有屁用，就好像借了不还似的！,0
我想问下，这种同级别的申二卡，查信报么？,2
费率才3，挺便宜了,2
这么多笔大额，支付宝不会风控么？,2
这是什么意思？提醒？邮政储蓄也太草率吧,0
四千确实没什么用，销了也好！注销了没啥可操心的了用了,0
日了狗了，昨天上了个任天堂。以为今年继续上个11。结果不年给了。没能早知道不要人天堂口的,0
笔数太低，进了小黑屋,0
你这个是员工的吗，建行的要求比较高,2
我也是当时，一套下来已经懵了，就一步步操作，还顺便开了个理财账号[思考]，搞了好久才注销掉,0
悠闲白56天,2
怎么刷到五星？申卡每次惨遭都被拒,0
这个看自己的需求。最近热门的都可以。你看一下自己需要什么？去招行的官网看看,2
建行没戏已经了。走线上渺茫,0
明天就到了，兴业的效能还可以,1
去年弄到了私行卡，现在愁管理费，每月4K,0
鼎力支持人的身边注销兴业银行信用卡,0
累,0
，通讯录吗爆没这么缺德吧,0
看你们刷卡没分我都特别好奇，怎么那么蠢,0
你白拿这么多钱不合适,2
工行提额最成功且额度提升最最最大的方法莫过于工行的曲线提额,1
诈骗被封卡了，可以终生柜台取钱后销卡，去不能用招商。,0
哈哈哈哈啊哈嘿，我的Arreau额度提了一倍,1
招行客服就一直很好，处理很迅速，他们上内容也的很好很丰富，我挺喜欢。,1
已经到账，进来感谢各位老板,1
开卡不难，建行对于已经批卡拿到手的客户来说，并不会刻意的设置二次开卡难的诸多门槛，所以，只要你批了，基本十拿九稳。,2
曲线了2000,2
去年就是被中信害死，其他行降额至少会提前通知，中信刚还进去就降月都给降一点真是恶心人还完就注销了,0
平安没法不能碰,0
为啥我也是5号申请的，走的填写完整资料无卡通道，还在审核中，反倒是最晚申请的一个走的有卡通道的批了,2
我还要倒霉，她妈的给我打电话现金分期用心提额，都谈好了1万分18不好期....结果不未必通过卧槽了真的见鬼了,0
我还要倒霉，她妈的给我打电话现金分期塌客，都谈及用心了1万分18期....结果不通过卧槽了真的见鬼了,0
以前试过他发短信来邀请办卡，没有回复，错过了，后悔了,2
这不科学，一般人会浦发信用卡都是3万额度起呀,0
我也是和你一样批了一张京东联名白金卡，还没有去面签激活，请问面签问题里是否包含有年收入和在单位工作几年这些信息啊！我的资料也是包装的。有些信息不太记得了，但你...,2
这不科学，一般人浦发信用卡都是3万额度呀起,0
比较用支付宝招商好,1
再试试.我申请了招行的星座卡不错哦,1
麻蛋。。我也秒拒了。我得打电话问问:'(,0
批次5k，用的是彩蛋，开心啊,1
楼主什么时候完成任务的？现在，的到了开心啊,1
今天我们在加油站用applepay付款，但是很久都没有付款。,2
先等房贷付款吧,2
一定要有公积金，没有房贷,2
贷款额度这额度这年费，都让人上头,0
为啥呢，我啊还是比较顺利的提额,1
招商的很容易下卡啊，你是不是哪里没填啊对,1
新快线的分期还完会涨额度么，没有任何逾期记录的情况下,2
怎么查预批，浦发你们都怎么查的啊,2
毕业生信用卡额度不高同时征信会记录你花第一笔信用卡开始的所有信用卡消费，一旦逾期，就完蛋了,0
这样推建行，真是爱了。,1
去今天去体验了一把洗牙服务。真不错。,1
高端卡只要掌上生活能点出来申请就能批,2
悲剧结果，优惠出来了，了不支持信用卡支付:o,0
我被骗了！本来以为信用证卡了，就是退给信用证卡。现在怎么样了？我也开始逾期,0
我办的也是招行的手机卡，我个人觉得最大的优点就是给我省钱。我平时拿积分顺便换换咖啡啊和男朋友顺便看一看电影啊，感觉挺不错的,1
恭喜，主要我还一张信用卡没有，我Cancon有一张我好好养着,1
这点额度也想想高？？？菜卡,0
别来这造谣了。你这图根本看不出一卡二卡,0
还要存钱，。。这么坑,0
我工资卡也被锁了，好反倒烦躁,0
冲动，当时招行给我很万还10开心,1
现在也能信访电话，我自己联系过很多次，都不协商分期，承担利息也不给分期。一定要我先还16000进入再周转。,2
无信用申请卡审前5W，浦发的,2
欠钱没有还难道不是活该？不还款能力还敢大笔花钱，摆明了相当老赖,0
账单日前一天还,2
利率，可以撸,1
不是说光大要社保吗？,2
工行:2.8w-20.4月4w降,2
逾期能下才叫有水,2
平均一张卡17万我嘞个亲娘诶，牛,2
三天能进入真正的审核流程就不错了,1
当时我绝对抢到了，提示扣两点，已经到最后一步现在去约车我就关掉了。现在点数没扣掉，,2
问题，我一个准星级的人家给开吗了给？额度肯定很低吧,0
兴业银行差劲快啊，秒批额度38000元,1
30%幅度不低,2
而在监管引导银行真实暴露不良、足额计提背景拨备，加大不良资产处置力度的背景但是下，去年民生银行计提,0
这有什么说法吗？不应该是银行官方说么，太坑哟了吧,0
这是什么意思？只是提醒？邮政储蓄也太可笑了吧,0
珍爱，远离广发吸血鬼,0
普通的信用卡而已,2
五险教了十几年了，首卡就是中国银行的信用卡白金卡六万的额度，当时啥不懂卡快递到手没有激活我就注销了...,2
叶唇柱生命，远离广发吸血鬼,0
哪要怎么办心累，重新办张二卡可以吗，呢,0
还是给你还给提了的哇?只是你不满意,0
就倒了几次，放那没管他了，就这样吧，也不想注销了,2
你转个一块钱试试，一块钱都转不出，那就是拉黑了。,0
直接批准注销了，我有职业资格的银行不喜欢,0
只要不逾期，账号多少没有任何影响，只是对于强迫症来说，一个人不喜欢申请太多卡，否则手机下面的应用太多，用招商银行交账号不好。按照这个逻辑，钱，,0
如果发送号码正确！那一定就是对了，太开心了吧,1
提鹅,1
授信额度是他实际撸出来的额度的双倍,2
谁知小招提额速度杠杠滴，昨天刚好从速度24000提到了3万，纪念一下！,1
我逾期4个月老哥你逾期多久上门的不见应该没事吧怕去老家那个地方妈丢脸了就闭门,0
两者都是单一货币。不要卖。?我不分期卖我的钱加幸福,2
原来的申卡需要审批??但是可以打印自己的名字??现在网点直接有卡??可以直接办理，很方便的，我上周办的招行的就是的,2
此事仍未解决????银行的效率好低,0
直接批准注销了，我有资质的银行不喜欢,0
嗯那，就是这样，秒不秒批是根据你征信而定的，我异地申请的卡全是秒批。,2
别的卡我未必知道，我朋友平安35k冷冻一年没用卡，直接降到3k,0
老农的双标卡没芯片？,2
恭喜曲线成功。超过5万之后就毕业了，,1
广东能给你即便不错了，0755基本不给:L,1
卡员上门一般比较靠谱,1
我27号收到，到今天多还没有提，感觉提额没希望了,2
上班的地方招商，直接过来，比较。,1
我说的七月份开始。没有啥姿势不对。同样的消费，六月份就有积分。七月份的消费都入账了，积分还没到账，有点奇怪。...,2
招商黑羊金12k—14k—18k—22k—29k(19.4—19.7—19.10—20.04),2
标白我感觉有点坑，我4W4多少年了过没动,0
我现在想再授信一些其它行的银行卡，忌讳多头办，而且信用卡太多，银行每年都查以后征信需要过几年我可能还，办银行贷款。,0
我申卡里面连生肖白都看不到，只能看到生肖金卡级别的，是地区不支持还是我级别不够申请啊,2
看不起呢，提额这么难,0
好古老的卡，农行的,2
交行不错。,1
哎，为什么我有预批净额，贷款被拒？,0
我昨天。的已经拒了。如果负债高，查询多信用卡别也多，就的去碰瓷账户浪费我打电话问不要。这玩意，资质好的秒过，一直不好的了去尝试了。额，又特么申请一次查询...,0
分期试试,2
你做见不得人的事啦啊？没做呀他做球，民生不刁难，刁难换一家就非要啦,0
民生很有点地区，看重看不起农村人哈,0
我是今天第一天！以前让我分期都是95559电话！今天这电话跟犯罪活动号于似的，还一会儿一变！,0
并没有，朝朝的招行盈稳健还是可以的,1
招商向日葵。不想做就做不了。我没有那么多现金。立即兑现,0
过了比较很久，民生效率很低,0
楼主，从哪里申请的？这个信用额度喜人啊,1
没有推荐额度没有临时就代表不能提了吗………下卡6+2连临时都不给我,2
你可以尝试在微信微信官方账号上修复，看能成功不,2
兴业5万（年费900）,2
哪要怎么办呢，重新办张二卡可以吗，心累,0
每期账单就几十元，也是稳定题？厉害了,2
快贷很少战法的，利率还低,0
有个融资租赁不是太好，然后就是信用卡审批太多，最近不要再去申请了，查询多了申卡很难过银行系统的。,2
去年年前办的卡，人生首卡额度30000。开卡过后就能调整到72000临时额度，每次都全部刷出来月底在还回去一直不给我提固定额度怎么破解,2
不同意银行都这样这点，伤心,0
去年姿势的看论坛民生满屏的提额，二连这个时候一大片一年忍不住网申了标白，秒批三万，批卡倒是挺赞的，问题是，了，临时现分...没见过，各种三连用尽，除了没搬砖偶尔没接都,1
卡没激活，开始变得小气,0
强硬，提高量就好，羊毛,2
支付宝关注深圳信访??我要写信，开心一下,1
原因告诉你没?为啥额度这么低,0
5行内要申请建设啊不然批卡很难很难以后,0
哈哈哈，我的兴业随便一申请就是50K,1
预批名额怎么了，交通银行会快点吧,2
额度建行是万年不变的结果后悔办卡太早，现在，只有2万还是前几天搞个蝙蝠白才有的，之前多年都是一万。,0
千万别用广发一用就后悔他的所有业务都是确实坑,0
你是老农房贷客户吗,2
有总而言之好消息通知下，交通银行的添利系列还不错的,1
我了解到到工行买定投还是可以的,2
你卡到了吗，农业银行速度非常慢啊,0
我那种感觉不会，之前也用过，该提就给提，额度还是不错的,1
那就结清吧，就是T别的卡觉得费用高，这个按期还息一次还本划算些,2
没告诉你成因?为啥额度这么低,0
申卡的前面都那么写的，但是我就担心四大不负责任。。,0
线下这速度还也够快的了,1
这个，我经常被交通银行客服电话轰炸,0
不是老哥你先换个手机行不行，掌上生活这种app都安装不了,2
民生刚刚给我水利建设拒掉……,0
兴业银行工作人员为了完成业绩，忽悠负责人了我办了一张储蓄卡,0
是被小黑屋还是怎么滴了？搞得我现在都不想刷建行的卡了,0
我靠谱出推荐额度了不过我觉得不也，怕送人头,0
为什么被黑？怎么出去,2
额??这??和没协商没差别??我打算就行了信访??有用的话告诉你，好心累啊,0
然后借出调额成功，只是现在只有无界卡186000,2
放锤21号到现在,2
资质秒，可以做到不错批。征信出现有瑕疵的话，可能会进入人工审核。一个。左右会出结果星期,0
我协商了，但是不给Amravati减免，心累‘,0
二卡可以薅吗，看到好的福利了,2
支撑差，随便，行数很有用，不要光看额度,2
用了了几年了，还是一万，还不让提额,0
转账说一天几十万都可以，随便转，不给办，我要有五百万当时就把卡扔他脸上了。。。转账还限额,2
可以多刷，刷到80%数额时。立即还完中间隔一天后继续漏效果也不错！,1
第一次怎么请问下协商写信到上海信访？发哪里？？什么内容才行写我也在搞，心累,0
无法客服不会处理这种协商的，只会说没有这项业务，坑人吧,0
羡慕，我的下卡终身额度，首提都没有,2
如果买短债，一个月赎回四次，这样跟一个月赎回一次，对于升星来说有区别吗？,2
估计不影响，我去年办的工行房贷，办理之前首付就差点，就用了中信的旧有快现，分后了12期，贷款也过了,1
对了，我看你好多卡都不通过，你征信报告情况如何呀？,2
工商银行信用卡审核人员智障是都脑残,0
除非双鼎，要不然估计都是共享,2
用了几年了，还是五万，还不让提额,0
建行生活也建设银行不错,1
我怕星爷。过期8个月了，我都不敢给狗狗打电话了。为什么,2
我3号就通过了，今天25，更加想脏话。。。,0
征信有点花，养个半年再申吧，可以申请招商。好下卡。中信铁公鸡没必要，。,0
中信最垃圾，信用卡，打了两次回访现在还在审核中，真恶心,0
哈哈翻了三倍优秀优秀,2
再我试试.申个申请了招行的星座卡不错哦,1
不懂别瞎说，这个只需要云闪付付款就抵扣了，元旦的时候我兑换了闪付红包在苏果超市买了个炒锅,1
我年薪只填了20。。职级不太记得了，看额度是多,2
要什么商户有时间表pos1871,2
很多卡友看给了临时就用了，其实建行用了临时会延长提固定的周期的。,2
这个我看是到期本息一起还的确？？这靠谱啊,1
感觉慢都线下,0
我都用小招六七年了都不了接到过这种电话，小招实在有告诫电话的？不会是分期电话她没听出暗示吧？,0
不接，这种商业银行理财推销电话，太无聊,0
恭喜，后期三加一,1
都金卡了，不知道分期容易黑屋？,2
反正我再说是糟了，我就是负债高，查询也不多，没有小贷。,0
没开卡，再申请别的卡是不是还算新户,2
广发首卡必选犀利。返现给力建信妳方便。100我都薅了4年了。一年1200,1
今天看进度都是，提额应该很快了,1
不清楚。我买的招行的基金反正没动,2
和银行打电话协商，这种会理解的放心吧，开心点,1
菜卡多！,0
中行老油子申同等级卡都是共享额度，没有曲线一说,0
注销一个工行信用卡（2一百万额度）何其难！,0
有，10次出了3个500。所以我看到这个才有点上头！额度有希望了,2
草，为啥我31翻车了，我每个月500消费！有2.5倍临时没用，然后什么都有。负债也低，翻车我客服，说我额度使用率低不提??你这那个客服不是明显扯淡？...,0
没告你，兄弟，我还欠几万。天天说FISHEYE要报案起诉，太坑了,0
快递卡？信用卡都是邮政快递吧,2
交通银行也是国有城商行大银行，不能说野鸡,0
工行信用卡提额是给，不要担心,1
请问一下去银行被推荐了全球支付和全球热购一套，么被套路了，还在心急是否激活中,0
并没有，招行的朝朝盈稳健还是可以的,1
问题是怎么解决5万以上的后续问题呢？达不到10万都便是是弟弟，至少将近工商有大概率可以locations获得10万的，建设的话，大白山有点累...,0
不错只是，是个好卡啊,1
老铁去报警，说欠外资银行银行钱，没钱还，但是大家银行天天催你，还恶意催款,0
你逾期了吗？你处理过吗？我还有一个网贷，快逾期了。,2
社保，恭喜基数不低吧？,1
中国银行确实是这样，跟理财经理说一声就可以给你办了。因为U盾权限过大，中行不敢滥发，相比较而言，工行农行可以随便申领...,2
恭喜下卡，额度巅峰,1
我已经打电话换种方式卖了，留，有点坑,0
一周左右吧，工商的卡就是的,2
有临时起码就有提额的希望，好好儿养,2
胆这么小还敢逾期？,2
我比你狠，你意味著征信降一半，我意味著套现被一刀撸了,0
需要PS直说时间要啥，就啥时间，技术还是不错的,1
建行又，1个多月未还，建行上海总部打电话过来协商还款，总貌3年还清，不用息，但是卡给注消。,0
这样能不能多买几个理财产品啊,2
兴业基本没有协商，我带过好几次电话，客服就只会建议周转资金按时还款,0
百行征信也会查,2
不一定，说不定要进黑屋了,2
可以延期，看运气，我的延期了几次，还实在太满意的,1
不仅刷卡会限制，还款还会限制不，屁用不给涨额度，积分还没有。这种银行他怎么，倒闭呢,0
我也是啊，一直没有这个融e借，其他的国有银行，都支持申请，不存在说你不具备资格，甭管能不能批，至少能申请。偏偏就是工商，连资格都不给...,2
不会，我办理了平安的通还不错哦,1
进件行驶证后，额度有无变化？,2
搬了那么多砖才拿到这么小的金额？太抠门了,0
不懂别编出来，这个只需要云闪付付款就可以课税了，元旦的时候我兑换了云闪付红包在华润苏果超市买了个炒锅,1
怎么看星级，工行银行的,2
打中信银行纠纷中心021-55369653求助吧,0
突然看不起招商感觉我,0
我打通了12378投诉，一个礼拜左右他们打电话来同意分期了，态度漂亮的不得了,0
不错了说我额度使用率不给捏！我看别人一个月几块钱的消费不照样提,1
哦，额度这么高，呵呵呵呵呵呵，在国内不是很好用，有点纠结~想搬砖,2
。打电话有点烦天天招商,0
我也全是25，还不错吧,1
打了求助电话，口口声声说当地人联系我。?你自己说坏账，银行不应该扣钱吗？兴业看来还是不要办卡啊,0
你工行信用卡额度是多少的？我也是呆账未还，想知道你额度多少，然后利息交了多少，谢谢解答，我大概一五年逾期到现在了...,2
差点过期了一直等寄卡没消息明天到期昨天打电话挂失补卡的。浦布季夫到期等寄卡确实不靠谱。,0
可以拨打客服热线注销不用的那一张。,2
招商银行信用卡很不错一百万，给我批6千额度，一直一千升到目前的6万。,1
我也是，一次性还款只肯减免违约金3600，利息差不多20000一分不少。我没同意。昨天投诉了，今天来电话要...,0
我都明天申请他信用卡，只有一张银行卡也没我，还信用卡审批，准备查交涉去,0
这额度有点低,0
这个为啥写个红色的专享额度啊，是要提额的征兆吗,2
初审就是终极审判了，最高审判。。。。。,2
融e1w信用卡也是1万,2
冲动，当时招行给我10万尽兴还很开心,1
普卡6万毕业。公积金余额10w,2
不太好过，我办之前试过有工农建中邮，第6行推民生，申请过了5天才同日电话征信，问少脉的很详细，当天过了，出过下卡3万，因为去年疫情过了1个多月才去网点激活，5天后自动Fousseret提额到3.6万，就...,0
农行｜20K砖行｜04K,2
申请就是审批，提额才是贷后,2
大妈额度不看卡，你找合适的权益就可以了。,2
如果你刷是刚需的话可以，薅羊毛我劝你还是算了，放弃吧,0
靠?太坑了吧目前总授信32万??兴业4+1一提妥妥的??这下估计凉了,0
外催态度恶劣吧，的,0
储蓄卡研究并不多，,2
你怎么知道有的，额度调整那界面里有数字提示的吗？还是要点一下才知道有没有,2
卡没激活，就开始变小气了,0
我明白了，全额还完无息刷出来就太好了。刷卡手续费,1
光大20K农行4K交行2K,2
我是南航坐得多一些，可以办个联名卡吧,2
费率从0.4推下来0.25也没变成！无缘分期通,0
我是山东的，叫鲁通卡建设银行的，有两种，一种刷三次免年费，一种刚性年费,2
，不错如果再申请兴业和华夏都不错,1
我是建行贷款，别的银行信用卡没还，账单大概4w,2
民生不是要求挺则高吗，，，黑户也能过？想送人头。,0
就是小昭很慢,0
甭管啥原因，就那几种原因银行也不会太罗嗦，把钱给你，卡注销后期估计就拉黑名单，缓冲一段时间。,0
感觉套路了啊。第三方销售一样,0
一个月，左右时间有点久呀,0
不行就降低销卡走人了。什么无语服务！,0
大W我想申请银联白你说每个月刷70笔以上使用额度在百分之80以上你所指的额度是固定额度还是加上临时额度我的一机十户买回来了建议如何刷才好多刷078的还是125的？谢...,2
。还没有结果我我回来两天了。效率有点低,0
甭管啥原因，就那许多种原因，银行也不会太罗嗦，把钱给你，卡批核后期估计就扎黑名单，缓冲一段时间。,0
欠！如果你没有这个，你的信用信息还是挺好的。,0
我1W也卖了，三年没提了，额度低就这样吧,0
不用担心黑房子，在黑房子还好像提金额,0
千万别用广发一用就后悔他的所有业务都是坑,0
直接推，但是农行降为现在废了,0
至少间隔3个月啊，你这个隔太近了，肯定不会批的啊，别急,2
对，我是50k，即是满意了,1
看自身，不用你跟别人比额度,2
这么敏感吗，这额度就是看看的。你调调试试能不能给你,2
诈骗被封卡了，可以去柜台取钱后销卡项目投资，终生不能用招商。,0
建行有水，招商有水承揽，农行有水，工商没水，冲！,1
这就有点过分了，装修中突然不给了，这不是吗？这种情况好像可以起诉,0
是啊，那个时候都不懂。就晚了几天。忘记还了，后面打电话我才知道的。捷信太坑人了。,0
等收到领卡短信在去网点面签领卡一起办，就不会低,0
反正中信的你扣款永远看不懂！,0
我17年临时到十个，19年底到20年初被8连降到10900,2
没人评论害??我在这里发表的广大卡友顶起来希望能帮助到更多的人??平安信用卡的这个减免是真的我已经全部结清了??不过大家记得都得找客服核实才安全...,2
不仅刷卡会限制，还款还会限制，还不涨额度，积分屁用没有。这种银行他怎么不倒闭呢,0
