text,class
又还好你提前结清及时止损我都还了快两年了明年十一月都要结清了??他妈的贡献了能了五六个了,0
以后不打了。哈哈，我套100多都被监控了。太坑了,0
U盾过期了，常年没用过U盾。。。,2
平安我的5折，0.41也不想分。感觉还是有点贵,2
一百多万的贷款。。。。,2
我也有推荐名额，但是觉得不靠谱，怕先派人。,0
建设2.0k错过提额短信,2
1000尚未准备好激活。,2
我也是，昨晚凌晨申的，拒的话9.30之前会来短信,2
朋友你这三个500是什么时候什么别人时候的？当我发现的时候，我心累么,0
现在已经顾不上利息的问题了，现在是每个月还最低看能不能保证征信了,2
我是3个月2次过的，开心很,1
我特么没逾期都频繁提示逾期并扣了违约金而且还款记录就是按时还款的,0
银行的钱别欠，每个本月多少还一点进去，别给整成信用卡诈骗了。,0
国内用可以再中行个积分0001，或者冬奥，撸5倍中行也相对。中行批招行不批可能是申请交集流水理财很香更...,1
如果点了会怎么样？即使其他人没有逾期，它仍然提示我这个配额调整没有被批准。,2
卡费要补进去吗,2
我没有交行信用卡，谁来组我？发链接,2
我也出推荐额度了不过我觉得不靠谱，怕送人头,0
你对砖行算是有情有义了，砖行对你不仁不义，销得漂亮不惯它！,0
8k能干嘛，低的可怜,0
昨天刘老太申请的，还没批??估计凉凉,0
分期邀请我了，不过只邀分期，不让提额，和我耍流氓,2
恭喜，我老婆25000都两年多了没了让提过,1
季日均开心这砖一个月就行了，，，哈哈哈,1
平安不支持跨行自动还款啊，不必这个不方便,0
是，信用卡很难批。,0
两家都是那行，一定要选，野鸡就留广发。,0
为啥我也不知道，09年办的交行卡不到一万，从来没分过，现在额度15万。,2
等十倍提吧，我也是3000，好无奈,0
这怎么搞就办个中国银行的信用卡？这么难么,0
主要有小额贷,2
城市里所有银行都在你附近，你可以去Google找工作。心累啊,0
正因为走了许多路的无数繁华与，我们才能在时光的流逝中体会岁月的变迁，越来越怀旧了，可能是老...,0
固提到2w以内靠谱，以上人头应该是送都,1
当然是拿来啊基金买，白嫖多香。,1
从两年批卡到开卡首刷然后第三天显示达标，至少也要四五天，到间隔时有没有就不一定了，不过这个好不容易活动时间还很长，还有小半年，就算没有也大概率会社会活动补货…心累吧,0
建行大山80k,2
我和你一样，申请吧，反正我没申请下来，你看下能有多少额度,2
数额两年了，额度依然很低,0
银行没毛，也没新户礼，你说不,0
广发现在提额慢了，2年没提额了,0
比如说，如果你只有 1 万块的资金，那么理财经理可能会给你推荐，销售起点比较低的公募理财。,2
你对砖行深情义气，但砖行对你不，又不好卖,0
我中行房贷??首卡批4000??我说啥了??连销了几次??现在预审批都没了搞不好系统记仇了??房贷现在都还11年了??这又搬了20砖??3个月后是骡子是马到时候就知道了...,0
农行下卡33k，不错吧,1
加我，我方案你出帮，靠谱的,1
对面可能是类似对话的人工客服。看到你发消息，他立刻,2
招商银行分期动不动就打电话信用卡，真烦,0
卡都没激活，就开始变低气了,0
越久额度越高,2
牛逼，白金100.然后年费几百，要是我直接拿刀去民生银行了。耍猴去？,0
调查审批和审批有什么区别，征信查询过多，还送了两条。唉,2
需不需要PS，只要你提供数字图片，想要多少PS多少,2
我的额度恢复了，给我发了个短信说我的临时额度已取消，你去app看看是不是也恢复了,2
因为现在额度为0了，也没办法刷出来用了，想还款压力小一点，是不是办理展期最合适？,2
请问除了建行还有哪些银行不必喜欢多头授信的啊,0
3万，中信降到基本上万还不错。2都是下卡,1
中行老油子申同等级卡都是共享额度，没有曲线古时,0
后悔了，当时不懂，乱申请的，当时都不知道大山白,2
恭喜提鹅,1
我协商了，但是不给减免，心累‘,0
大哥，那23k额度，怎么办理25K的账单呢？,2
招商银行信用卡很不错，给我批6到额度，一直升千6的目前万。,1
三楼你把问题说清楚我好解答你！说不清楚，心累啊,0
不错了，说我额度使用率低不给我提捏！我看别人一个月几块钱的消费不照样提,1
申他要是，换家，那么多银行，非要在浦发挂死,0
其实心里1舒服，资质不好下卡不万，别提太辛苦了，,0
没有优缺点吗？或者说选择性的差距？以及额度发展的速率,2
鼎极白开卡后，打电话销了这两个卡，DIY卡多选它不但了2项年58元，不能自选还不能取消订制，只有销了它。,0
怎么刷到五星？申卡每次拒被都,0
线下这速度也够快的了,1
现在呢？这一期我的确没看完?心情不好?,0
你这征信，难。。。牙痛再搞吧,0
Young卡是一张面向年轻人的信用卡，申请人申请年龄限制在30周岁以下和，这张卡的申请门槛相对比较低，容易下卡,1
别理，他有病,0
签约，征信应该只显示贷款审批，不用，应该不显示吧，如果要是显示，我其他的卡就难提额了,2
出数字不管临时和固定的稳都很,1
工行的提额是最给力信用卡，不要担心结果,1
中信卡利息真高，真坑，建议最好不要用，我现在入坑了，没法了，只能慢慢了,0
你的不清楚，我的前天插卡刷了两笔有积分了，之前那五笔是用闪付挥卡的不知道是不是闪付没积分了，别人闪付有没有也不知道...,2
撸你业绩。。哈哈。。结果反撸，被坑了,0
都是褥羊毛而已，钱，日常薅还是很开心的哦,1
最近不幸的遭遇一次被盗，为了安全把所有银行卡换了一遍，其他所有银行二话不说都给我换了，唯独神经病一样的交行客服,0
不同意银行都伤心，这样,0
基数，社保恭喜不低吧？,1
没告你，兄弟，我还欠几万。天天说要自首起诉，太坑了,0
还没过？太难了,0
征信报告有一栏近六个月已使用额度,2
有房无车..额度感觉会比较低,2
以前七行了时候提过了，后来九行的时候就没提过了，快两年的没有感觉贷后，一次银行不指望两次，不靠谱,0
30号开户成功，至今没动静。去网点办其他业务，找大妈问了一句信用卡，结果被强烈推荐扫码办卡+注销未寄送的卡,2
3.6W.月供应量多少？3000多,2
中信最垃圾，申请信用卡，打了两次回访，现在还在还审核最中，真恶心,0
招商银行信用卡很不错，给我批6千额度百，一直升到仍旧目前的6万。,1
不在黑屋也，一年了，有，想注销了,0
这就难了，我的5000个菜了要卡平时真的给淘宝买个菜储值卡，别人呢,0
其实心里没有舒服，资质不好下卡1万，别提太辛苦了，,0
怎么用卡的？我都是去超市小额多刷的。额度就很快上来了,2
恭喜恭喜！??我激活两周一年了中联，还没首提！??你总共有几行卡啊？招商每个本月月剩多少在卡里呢,1
</s>一星首开卡给了50000…懵逼了,0
刚拿到卡之后我看预审批更新了，想曲线芭比白，昂被拒了。。。,2
估计个人信息信用信息还没查，这个浦发效率有点低压,0
中信就喜欢你1000以上的刷，刷多了仍然会说你存在蓄意套现封卡降额，笑死人,0
银行的钱别欠，每个月多少还一点进去，别给整成信用卡诈骗整成了。,0
我普卡也拒了,2
是比较，老农那套系统，的恶心，学学人家浦发,0
工行没什么权益和羊毛，只有境外返现好像…没什么…下卡5W，四年没提过,0
亲哥的，开心40k不行了,1
去网点办其他业务，找大妈问了一句信用卡，结果被强烈推荐扫码办卡+注销未寄送的卡,2
还是给你提了的哇?只是你不失望,0
我也收到这个邮件了，电话里和承揽那边说又不上时剩下的，挂掉电话就给我发来邮件，这是催收手段还是真的在做...,0
季季日均，这砖一个月就行了，开心，哈哈哈,1
后面额度不一千万知道好提不，据说5万以上不会提额，困难,0
你傻吧乘以月费率4那就是要，2。,0
中行老油子申同等级卡都是共享额度，没有曲线一说,0
积分平常农行10000就值10块！你说这个好不好？,0
招商向日葵。不想做我做不了。就没有那么多现金。立即兑现,0
也不知道这个圆梦金还最低是怎么计息的，我也是稀里糊涂，反正高利就对了,2
垃圾招商银行。我是被拒了。隔壁民生开了张10多万万的。,0
不用人神共愤，大爷愤就够了。,0
垃鸡已经被很多行都干了，换新，小额多笔。,0
楼主什么时候完成任务的？现在，我的到了。高兴啊,1
还没有，银行叫我把网贷还清，你审核了多久放款了吗,2
看我今天的猴行帖子，这征信也能过，我真是震茎了。。。,2
就这种，就的基金建设银行很给力的,1
我下来16000，打算留一年观望一下，最近看坛子里提额幅度很大,2
，atm别用真坑,0
很久以前开了个所谓招行金卡，没啥卵用很久没了，昨天突然想起拿来收了200多,0
面签，7号业务员来公司办理然后一直没更新。这可怎么办呀，坑死了,0
请问一下去银行被推荐了北美地区支付和北美地区圣阿穆县一套，是不是被套路了，还在犹豫是否激活中,0
真的我去年拒绝了今年也没敢申请,0
但是征信报告上面是13000协商只处理了一半,2
借出去打电话客服调码,2
我圆梦金这个就被它坑惨了，还是不要用了,0
四大银行白户的话办的额度都是比较低的，有须要可以找我们招商银行的都是两三万起批,0
应该是中信银行的明日贷不错的,1
有的客服说话不过这话的，像浦发的就是,0
100%结账，首付。,2
不知道当时忘记问了。。。从那以后和中信弄清楚无缘算了野鸡行不要也罢,0
怎么什涅刷到五星？申卡每次都被拒,0
转账用。我觉得中行的最好，什么都。APP也还行。,1
6万额度能高了，所以回去起诉你。也许真的起诉了？,0
民生很看重地区，有点儿看不起农村人哈,0
楼主怎么拿到白金卡的？,2
你欠一般来说多少？如果不是恶意透支一般不可能涉及刑事，别听他恐吓！,0
一星用户，狗日滴，然后我什么都干不了，贵浦发,0
小贱Nagapattinam么抠门了，区区几十万积分就这副嘴脸。,0
兴业一生黑,0
我去弄是也工行，10行，57W，怎么申都不下！,0
七八年了农行还是6千别的行7万多的都有了,0
我了有协商了，但是不给减免，心累‘,0
这个应该从2万开始。我申请的时候，2.2,2
我五万用一年，昨天才提五千，10%幅度，这提额的速度,2
招行APP做那些确实比的带中国的好不少,0
银行消费者热线给的电话，我后面是信访发邮件，投诉网发投诉，这个电话也打。后来协商来了，不知道真正起作用的哪一个...,2
供货感觉套路了啊。第三方销售一样,0
哪有什么水？根据我的经验，四大行审核是最严格也是最系统的。我5月AUM值35万，6月100万，7月305万，然后8...,2
拖欠你严重逾期，还拖欠贷款一次。,0
打上海银行纠纷中心021农业银行-55369653求助吧,0
已经下卡了，23k。要去网点激活。,2
你看我那句话，什么时候加了个也了，前面说的是融e借，后面是说快贷，然后补一句不占信用卡，麻烦不要理解错误，没有这个也字...,2
我也是一直被拒，不懂原因，而且都是秒拒,2
这么多干啥，有啥意义么，网贷坑啊,0
不是首卡客户，不免首年年费，玩不起啊,2
建议查还有征信报告，你可能会有惊喜，,1
我4星加常年10几个小砖，他拒我没法76次，最近反倒一年流水大概700多万吧，崔勇虽然没见过那个预审批额度出来，我还是白户呢，应该不存在卡多问题，也没有贷款逾期，申什么拒什么你，估计没人...,0
建行的优势绝对不在即使信用卡上,1
我也收到了确定不用管？心里慌啊,2
民生是越来越辣鸡了。准备注销了,0
制卡中，效率比较高,2
能过的写自由职业一样过，写好听点就是了，比如自主经营之类的，职位确实要写高级管理之类的，已婚大专收入高点都是必须的，四大行第一次没推倒就做好长期推的准备吧。水电...,2
晕还，，消了它能忍是我就注销了,0
的，一顿操作最后提额,0
以后你不爱借，点了就动手。,2
过，面签就行，太开心了,1
没多大的用，我过当,0
傲娇的银行不敢现在我都，申请，哎，之前招行还是不错的,1
我去年拒绝了今年也没敢申请,0
建行第二个，工商第三个。你已经第七个十行了，小贱哦有些难了，销3-5行再试试吧。,0
招商银行信用卡动不动就分期,0
恭喜恭喜是小招终究，想起你了！,1
老哥说的有道理，我考虑到了这个问题了，可是一次性25000好难拿出来,0
没有，论坛。那些老板的帖子互相抄袭，甚至出错。,0
40k，不行了,1
提额更难了,0
吓死我了赶紧全部了，分了9期，就算降了不至于缓不过来,0
羊卡吧，young还是卡不错的,1
已经到账，感谢老板各位,1
有参考价值，我同事75000。下卡61000.我5万。下卡就5万。,2
提供了工牌，社保卡，近三个月招行卡流水,2
真有这种操作？我试了三张实体没过，放弃了。房子下来了，征信无所谓了，如果可以愿意一试。楼主是钱借出来在申卡？...,2
还好十一月提前结清及时止损我都还了快两年了明年你都要他妈的了??结清贡献了五六个了,0
搬了那么多砖净额才拿到这么小的金额？太抠门了,0
这个不算什么，轰炸经常被交通银行客服电话我,0
我明白了，本息还完之后无息刷出来就太好了。刷卡手续费,1
两万起，浦发的额度,2
我是卡中心给我说办下来提一倍我录音了，MP开心,1
不懂是不是以前腿毛卡搞太多了,0
你好请问钱的你取出来了吗，哈焦虑,0
这东西只隔捅纸，一一层就破。难免心直口快的有时候被说。心凉凉的,0
哎，为什么有预批金额，贷款被拒？,0
已有：民生兴业光大华夏广州招行,2
拉卡拉还封顶啊？那不错啊是我也，。万，准备4刷万一，分几次刷出来20没出现什么问题吧？,1
你说的就是扯淡呢，除非你，本地的不是不然不可能要这些东西,0
上大学那移动过几张会办卡，都没正常销户，欠费都后来停机，后来就拉黑了。,0
信访是哪个？哪个网站投诉的，完全没有作用吧，搞的人心烦,0
工行卡可以的，好养,1
隔天几点，有确定的时间么,2
了的啊，额度太低千三,0
试试？是不是秒批？中信必须呀秒啊,1
以前有这个卡，然后逾期8个月，还完了，好几年了，还能申请嘛？？？给个意见！,2
民生还是很容易，多刷就能提，风控也,1
每月0.35%，这个有点高啊,0
最近不幸遭遇一次手机被盗，安全把所有银行卡换了一遍，其他所有银行二话不说都给换了，唯独一样的交行客服,0
民生免息期最少才48天？,0
兴业是真坑了还完注销准备,0
用中行的比较总之稳妥,1
单标我有了，最近visa双标没能返现活动好,1
估计不影响，我去年办的工行房贷，办理之前还差点，就用了中信新快现，分了12期贷款过了,1
网申的？??我被中信银行打电话邀请的??之前卡没到打电话客服??客服都说查询不了额度??要等卡到了去激活二次审批才能知道额度????今天卡到了扫了一下二维码额度20000...,2
平安只有8连,2
年利率5.68%，是不是比较高了，还有请教下各位老哥老姐，如果,2
容易保证金。管理费悲剧,0
打了投诉电话，千万别口口声声说有人联系我。?自己你自己说坏账，银行不应该扣钱吗？兴业看来还是不要办卡啊,0
这特么是4万4，不吉利啊,0
交通注销了不是记仇吗？你主体资格很好?几行了?,0
开心关注深圳信访??我要写信，微信一下,1
我在学校办的下卡5000，不断更新工作后更新信息直接1.5w，工作半年涨到实在1.9w了，临额4.5w，可我还是再创历史新高觉得好慢[捂脸],0
怎么样，结果可以不,2
只是后来自己办储蓄卡业务的时候去柜台顺便提醒我把身份证更新了。,2
我靠，四大最耐撸，不怎么不怎么，天朝最耐撸的光大银行也这样了吗？,0
不能暂缓，只能用一个月，到期全额还。一定按这个来。否则你就从今以后入坑了。吃过这个亏，因为10w临额绝大部分崩盘,0
几天审核完成的,2
去年了到弄私行卡，现在愁管理费，每月4K,0
我也是银行致电补充信息，还是被锁了，申请解锁，7天了没任何反应，气的只还了个最低还款。,2
2.5的利息，本息真爽,1
我工资卡也被锁了，好烦躁,0
看你们刷卡没分我都特别好奇，怎么那么你蠢,0
所以，分期买手机也是没用的,2
现金分期有红字吗，还是直接点提额？,2
应该是中信银行的不错贷明日的,1
这个最后怎么处理了！我的也是这样,2
惨，吓我一跳，我掉下去看了临时还有。不过额度很低没意思,0
比如你想要交通银行与个合作的联名卡，信用卡他家的最红星期五、周五饭票站等等，交通银行还有还有京东额外好处，免息期最长56天。所以我五折交通银行。,1
我的-个人资料-联系地址??，刚瞅了眼我自己的信息，好像也乱了，我都怀疑前几天e分期一直秒拒就是因为办储蓄卡的时候地址又给我搞乱了。...,2
七月在战，额度一定让你满意,1
换什么，老铁。我坚持浦发的用了十年了,2
搞得像很多人办供不应求似的,2
不会养?需要卖卡重申的额度也不错，,1
全借出来就能直接调,2
你的利息比我的多。?我的本金是十万?五年过去了，本息2,2
我已经打电话换种方式卖了，不能寄，有点坑,0
两张卡单独额度吗??那我再宁波岂不是有12W多的授信？,2
我打电话力推信用卡分期还款，工行没同意,0
没什么大坑，积分不算丰厚当然冲个话费什么没问题海淘的话汇率据说建行比较划算要不要开主要是看额度如果你觉得额度太低侮辱你的就别开如果额度还行就开吧,0
三年前，秒批过一千的，路上就销了,2
我也掉了好几百，每个月一号自动掉？额度慢慢掉,2
这个不算什么，我经常被交通银行客服电话轰炸,0
申卡不是不用100%，所以也不要掉以轻心,0
我只知道中信会在当天下午12点前付款，甚至是11点:,2
网贷逾期过，这也能算良好？下5w不错了,1
说招商好下的都是瞎扯，百分之八十触发业务员上门，基本不会秒的银行,0
我的经典白刚下,2
我的网捷贷2.7个，当时那个经理说额度太小了，让我借钱，然后他在给我贷出来，但是要涨利息，我说不用了，我不想再贷了！征信记录啥的暂时就这样吧，我也确遇到困难，我...,2
你炫萌萌白金信用卡农行值得拥有,1
审批取消。属于有金卡资格客户，达不到白金鼎雅鼎致资格。。,2
都有，放心吧，招行服务很好,1
分了了就难提额了,0
:L没想到的确中行也是这种套路,0
不好意思，没看你前面的逾期你家里楼主千万别轻生赚钱了想想啊，只要你人在，就有还，，希望啊，我朋友生意失败，银行贷款2.3百万还不上，，房子都卖时间，也不够还的，还...,0
如果逾期时间较长，逾期金额较大，就是把你加入银行建行黑名单，从此银行卡再也不能申请建行信用卡。,0
天天打电话有点烦。招商,0
明白了，全额还了后刷出来没利息就太好了，刷卡手续费比账单利息便宜啊，太值,1
首卡啊，只给3k，简直了信达。这个中信的额度啊,0
没临时也算正常，问题是能不能提额？,2
没说清楚，那钱到底是怎么产生的？是什么收费项目。中信每次就这样,0
对，我也掉到了?我今天给客服打了电话?据说看到了几个，不可能,0
小事儿能判刑8个月？死坑网贷人啊,0
顶多贷后管理,2
试下提固定，万一有惊喜呢,2
单张广发欠这么多？,2
一扣款就拿临时说事。好几次了。接线员也是每次都这么说。就说给我临时了。中行的政策有点恶心,0
你怎么他才3k，不过好养的，我标准金下卡15k，想用用了近6个月首提到19k还挺不错的！,1
那犀利卡不是废了？,2
怎么刷的？每月多少比，有多少是真实消费金融的,2
比如你想要的与京东合作交通银行联名卡，还有他家的额外星期五、周五饭票五折所以，交通银行信用卡还有个最红好处，免息期最长56天。等等我站交通银行。,1
天天打电话有点烦。城建,0
复率据说年息32%，建议不要借吧，我之前借了5W，分36期，借了就打碎坑了,0
兴业银行焚化炉太垃圾了，同感。正常还款消极，用卡总而言之，兴业把我的卡止付了，问原因，不给说，还他妈态度蛮横,0
招商15天严重警告还款??威胁,0
请问这种鸡怎么截屏的啊，完全搞不懂，心累,0
千三了为的啊，额度太低了,0
我也是，前天收到SNS核准说可以提，但是昨天看他们核准的都提了，我也没用提，看样子这次阿又凉了,0
可以不错，利率撸,1
8k的干嘛，额度低能可怜,0
我没用过，所以也不太清楚，可以在论坛里搜一下这方面的帖子,2
等消息，的交通银行沃尔玛卡批啦,1
为啥销？理由，额度低总金额呗,0
兴业银行的套餐也是比较多的,1
为什么不报白金卡？为什么喜欢这种端着毒鸡汤的感觉,2
协商中行试试，上次浦发的协商成功了,1
没告你，姐弟，我还欠几万。天天说要报案起诉，太坑了,0
邮政网申。提交资料拒，和同事申他批了2万，网申的卡，又让我去重新盖的公章，网点还不想给开卡，差点让我投诉了结果1年到9K，2年不涨...,0
网商贷5万,2
直接网申还是全民分期易啊,2
去年就是了中信害死降其他行降额至少月提前通知，中信刚还进去就降每个会都给你，一点真是恶心人还完就注销被,0
不久前被银行忽悠就办了，想问问大家不激活会有年费吗？,0
从文字里看老哥还是很潇洒的，羡慕能做自己的人,1
估计信用信息还没查，这个浦发确实效率有点低压,0
不错了年龄那么小就有那么多卡就不错了，好好用,1
买了半年十几万理财，刚刚秒批,2
我融e借额度还没有卡的额度高,2
1999真好，运气是银联的,1
这是什么了用意思？只是提醒？邮政储蓄也太草率了吧,0
有工商银行工资卡流水，额度会提高,2
恶心特就是的银行，信用卡我都没用也月月贷后有时候一个月还两次,0
老哥古训说的有道理，我考虑到了这个问题了，可是一次性25000好难拿出来,0
我原来也到不了刷脸这步棋，直接拒绝，这次让我刷脸,0
这坑我跳了，头铁顺便提醒一下大家吧，当然也的我没意见,0
中行还，五次刷免不知有没有实体,1
民生唯一优点就是额度党拿来TX，活动没活动积分没鸟用连都没有了还要它干嘛？,0
关键连个电话还是短信提醒都没有，直接就关了，工行够狠,0
【工行】Mc环球金,2
因为建设银行的固额是系统评测的，所以没必要太注意调额的间隔。不过一般来说首次是六个月，之后间隔是三个月,2
可以延期，看运气，我的延期了几次，还挺在意的,1
了更难提额,0
抠门银行，没毛，也说实话没新户礼，你说抠门不,0
因为任务量飙升，不放水就完成不了kpi?我明白了...,2
3万下卡即时进黑屋，民生3万额度很的,0
带发工资他呢，那我的工资不会被扣了吧，太惨了,0
额度一万以上就是白金，一万以下金卡,2
正常首提是6+1的，你现在已经过了这时间，但是你现在临时又出来了，估计下个月会出固定，这个月保持良好用卡，多刷小额真实的，例到便利店或是大小超市买可乐买零食几块...,2
我的提了，2个月了都，平安还是真爽的,1
异地申卡吗？我也想申请个招商的，异地，怕上门，有招行储蓄卡，招行有理财。,2
兴业银行的优惠活动也是非常多的,1
四大银行白户的话办的地方银行额度都是比较低的，有需要这样可以找我们光大银行的都是两三万起批,0
我不但申请的耀红卡为啥一周了还没通过,0
实时3万下卡即时进黑屋，民生3万额度很邪门的,0
代发就能过啊？那说明是资质不错的，一般银行G5V批信用卡的,1
说了半天原来你没信用卡那怕个啥啊！,2
我理解楼主大妈就是这样无任何个人逾期本来负债我特么当初根本就没有任何负债个人就有你三四张卡只是大妈解释那张额度不高我就偶尔网购没有刷过任何机器结果隔几个月就降额现在1...,0
额度占用信用卡额度，那就不值得用了吧,2
