text,class
我也是，一次性还款只肯减免违约金3600，利息真的差不多20000一分不少败诉赞成。我没同意。昨天投诉了，今天来电话要我撤诉，豁免然后他跟总行最末那边申请减免。我就担心最后还是不给减免，...,0
民生??分期不可以降负债的：工商，建设，农行，光大，招行，华夏，浦发,2
我现在想再办一些其它行的银行卡，忌讳多头授信除了，而且信用卡网银太多，银行每年都查我征信办，过几年以后可能还需要办银行贷款。,0
我也是生肖白1万曲线到5万的，年费有待确定，app显示和kf说的不一样,2
我上次就是，光大给了临时，我用了，结果过一个月就提额了,2
广发首卡必选犀利。返现给力方便。100我了4年了。一年1200,1
哈哈哈哈啊哈嘿我，的额度提了一倍,1
恭贺恭喜恭喜！白金了么？,1
哪那么多戏呢？你就是刷34800米粉店，银行都不会过问,2
网申c标白下了1.8W。服全幅单反都用不了…连买个了…,0
也数多少其实无所谓：在银行账户信报里面不起眼，版不构成小昭小贱等厌恶的多头授信,0
工商2.6浙商5.0平安5.0,2
用圆梦金??起点金额设置10000起步??别用借现金??圆梦金刷出来算卡的临时额度??借现金的话多一个还款账户??...,2
我是那时第一天！以前让我梅西县都是95559电话！那时这电话跟诈骗号似的，还一会儿一变！,0
我协商了，但是不给减免，心累‘,0
我听说金葵花，钱不够也可以办，只是缴纳管理费就行了，一个月160，小钱,2
老哥，不能道理我都懂，就是难啊，有本能难念的经。不知道还3个月最低家家这个了，三个月能还上25000。,0
难道是工行睡眠Kaysersberg降额？,0
真的不如以前了。,2
招行的做的确实比那些带中国APP好不少,0
首卡，额度可以了,2
另外高可选择的：广发白金，额度即可，权益好。活动期内不用刷，绑定vx，zfb一个免年费。,1
我下卡5千，五年多了，都没有动静。这个额度也是没谁了,0
优秀。同短信邀请，已开户半个月还没寄卡。电话问网点，被各种质疑：你是网申的吗？短信，是不是没填资料？一般一星期就到，是不是还没批？...,2
民生天最长才48免息期？,0
我首卡都是6万万?融?借额度11??E我想故宫信用卡额度??去申请二卡调平白金??额度才30000??搞笑呢,0
低利息那么低，牛皮,1
我明天也申请一下。额度佛系,2
大佬，，申请未通过。伤心,0
我对四大行很失望，打算卖给购得中国银行。工行的两个真的5000已经冻结2个月了，所有推荐都消失了。,0
上次邮储放水都没通过，,2
资质不错，可以做到秒批。出现有瑕疵的话，进入人工审核。一个星期左右会出结果。,0
是感觉套路?第三方销售也一样,0
回访什么？，打座机么？完蛋,2
应该是圆梦金加授信额度超过了信用卡额度，中信风控了。估计只有还款到不超信用卡额度才能恢复。我之前也有类似情况，每月都是负8000，大概还了一年多只进不出，现在恢复了...,2
万28花4.5，感觉不错,1
我每个账单周期都是刷掉总额度的80我％，提额很快。,1
我用了圆梦金和现金分期后就黑了，被限制消费了！,2
这么,1
你说的怎么像是招商银行的错人家，是似的逾期了，你才不给你分期的好吧,1
还没过？太难了,0
没有，就来短信，或者电话就很方便,2
中信信用卡，同时申请两张，一张批核成功和一张初审通过，有什么区别,2
猪菜更难了,0
我也又耽误了我们但是，当地分公司一直打电话。,0
正因为了许多路，经历的无数繁华与我们才能在时光的流逝中体会岁月的变迁，越来越怀旧了，可能是老,0
不知道啊，什么瘤果都没有，招商主卡还给拒了，虽然还是白户，很气了，招商狗东白卡不上门据说,0
你面签审核复核好快。我的还没审核呢，资料处理中,1
我只绑了两个卡，每天4000积分,2
小黑屋一直可以塌客啊人家银行大数据让你提就提和其他没关系是大黑屋提不了,0
广发客服真水，同一个问题同一个电话反驳，另给,0
我司一台破电脑，下载打开天书那个文件，招商都可能死机,0
我办的也招行的信用卡，我个人觉得最大的优点就是给我省钱。我平时拿积分去咖啡啊男朋友去电影啊，感觉挺不错的,1
本人近日误入广发银行的坑，以此经验教训‼️建议大家以后慎入广发银行信用卡‼️‼️,0
先提升资质，再办卡。先办好提额的最后再办不好提额的。你把提额的希望寄托在中行，思路就错了。我也是绕了好大一圈弯路，还绕了一年，妈的。...,0
哈哈，我没有预审批，代发社保公积金，6行批的，老哥命苦,2
楼主，这提额幅度，摩拜！,1
希望新卡新气象吧，看能不能续上五年提十次的前缘。,2
别的卡有钱吗？先救急，用用，,2
哎，生气，坑提额都每次,0
朋友圈关注深圳信访??我要写信，开心一下,1
你这算啥我5.13号就这样到现在估计凉别人了,0
比如信用卡想要交通银行与京东合作的联名卡，还有他家的最红星期五个周五饭票五折等等，交通银行、还有你额外好处，免息期最长56天。所以我站交通银行。,1
总债低没有网贷及时还最低,2
朋友你这三个500是什么时候什么时候的当发现的时候，么,0
交通注销了不是记仇吗？你资质极佳?几行了?,0
10行卡很多已经不少了，你有没有发现，卡多了提额难？,0
催得猛么我想问爆通讯录？？,0
我见到过一个案例啊。也是逾期很久直到被起诉了，银行也不敢动他手机卡里面的钱。最后法院判了用手机卡里面的钱强制还一小部分，留著一小部分生活用。...,0
你这征信根本就是，难。。。养养再搞吧,0
建行感觉看行数越早下越好建行提额很也挺慢,0
不错不错提额方面有什么心得体会吗想学习一下,1
:L的确套路中行也是这种没想到,0
建行的所有人，提额都很迷糊。,0
核对哪些信息，身份证，房产反正招行是这些,2
我哭了，居然要这么久，其他是半年久开始了，第一次搞竟然这么慢,0
工商银行的信用卡是经典信用卡中的常青树，在工行区的讨论热度也常年TOP1。,1
回访电话都打了。还是拒了,2
我12万被农行诉讼了，法院已经判决，反正也没管，估计进失信人了,0
没有语言去表达,0
建行app上先报名了，争取刷到，哈哈,2
难道是工行睡眠卡会降额？,0
民生我也是申请五天下卡了！征信隔天批了！1,2
你他行信用卡有逾期人行的征信记录肯定有影响，很难办下来。,2
顺德农商_14k,2
微信关注深圳写信??我要信访，开心一下,1
招商银行信用卡是开去好卡，用卡的朋友里大部分就是都推荐工行招商银行信用卡，简简单单三个月，一提两年之内毕业，肄业临时额度可以到固定额度的2.5倍，好好用，绝对是一张好卡,1
Young卡是一张比较年轻人年龄信用卡，申请的限制在30周岁以下，这张卡的申请门槛相对面向低，容易下卡,1
搞定了?致电客服唤醒?太坑了，没权利?一根头发都没有,0
圆梦金加快贷二十个，每季度还到泪流满面，特别是每个月限额确实刷2k，现在只敢每月还最低，每个月金利息被吃傻了。,0
呵呵，解决了吗？我的跟你一样，好操心,0
广发卡一年了正常用每个月平均四五千，上限额度四万二，一年都呀没提额显示不符合条件为啥,0
"我现在也是懵圈当中，之前稳定三个月一提,自从授权后，翻车6个月了，临时一直有，固定没有，我现很矛盾，关了它就害怕错过提额，开着呢，只给临时没固定，6个月这个时间段...",2
不试试怎么知道，浦发的就批了10K,2
额度，高吗,2
我也是在0322网点申请的。半个月都是这样。当时我等了十几天就发到我单位了，效率还可以吧,2
那时手里还是张普卡，刷了额度不到三年，两年就登顶毕业了。,1
我是没机会了，到顶了，我在平安10年了啊,2
工商的盾不值钱确实是太贵，还不如邮局20块,0
优质就申鼎雅鼎致,2
那他家办理分期，需要先还一部分吗？这几天一直在谈判,2
50%不值于吧，0账单全额那算啥，分期保平安好了,2
民生异地不能激活,2
这起诉有点过分不，装修中突然了给了，这不是坑人吗？这种情况好像可以就他们,0
容易。管理费悲剧,0
6块砖后只有一次抽奖，保证60r?6*55=330,2
我都申请他信用卡，只有一张银行卡也查我，还信用卡审批，准备明天交涉去,0
这坑我跳了，也顺便提醒一下大家吧，当然头铁的我没意见,0
不能转修，暂时不用，用一次就好。,2
招行都换5年黑屋了。废我还怕他？！,0
看不起谁啊是吧，招商银行给注销了,0
最垃圾，申请信用卡，打了两次回访，现在还在审核中，真恶心,0
应该极佳是中信银行的明日贷不错的,1
垃圾银行就注销，早点没一个像他这样的,0
我有张上海交大，的额度还挺高,1
我也是上午申请下午来短信通过，也是b卡，不过我的额度没你高。恭喜了,1
其他野鸡行全已销户,0
一般情况都能，放心吧,2
毕业办了first卡，但听说经典白好一些，用了3个月了，能换经典白吗？一行2张信用卡？还是销卡再申卡？有必要换吗？,2
估计除了不影响，我去年办的工行房贷，办理之前浦发银行首付还差点，就用了中信的新快现，期时分了12期，贷款也过了,1
的，老农那套系统，比较恶心，人家浦发,0
纯信用卡额度吗，不算那些乱七八糟的备用金分期贷款额度哦,2
招行信用卡是甚至于很多人的第一张卡，是因为它的确是有很多优点。,1
兴业银行好快啊秒额度38000元,1
我不会。了之前在工行买了她们的基金被坑我,0
关键是现在没实体卡啊一张无界一张clear即便借出来调沙埃无界…刷不了pos啊，好心累啊‘,0
我中行快一年了都不出额度,2
没有语言表达去。。悲哀,0
你好。你中信逾期多久，协商成功的呢,2
有点乱我的显示是可以分期10万借了5万??固定额度按照可以分期款x2显示的并不是按照你借了多少来的不知道这个是系统直接生成还是人工就是怕授信显示太高才弄5万结果...,2
我们单位国有控股的，不过没上市能办不，额度咋样,2
哈哈哈，我的兴业随便一申请就是50K,1
楼主我的和你一样，后来能提了么，,0
民生拼手速闲，累,0
这个星没什么用吧，提额才是关键,2
等我了17天了。。。太慢了,0
诈骗被封卡了，可以去柜台取钱后销卡，终生难以用招商。,0
准确吗？应该准确的，不用担心,2
中信的利息有名的贵,0
活动说明不是写的100050-元么？你怎么还抽到25的。。。太坑人了,0
我靠，这张数字有实体卡？真的假的？,2
继续涨的，催收电话也会一直打，就是说让我每个月还一点努力还完,2
前几天Saverdun到，29号以后0532沿海地区也查不到了，是什么情况啊，太难了,0
不分，分期不划算,2
48期应该可以了，我的招商本金6万逾期2期还没有协商成功,0
兴业银行就是个垃圾，我用兴业银行信用卡六七年了，至上个月从来到没有逾期过，添加而且使用频繁,0
但是他说要先在本地网点办还是什么情况，没说特别清楚，有点晕了现在,2
刚换资料新户申请，下卡4.5，老卡！，兴奋1,1
这就回到了开头我们小故事里的问题：张努力这个劳动力打磨了 20 年，最后产出价值和 100 万资金一样？张努力人力资本价值=100 万元这个等式成立吗？,2
信用卡收到了新卡片，这个准备激活，发现我正破刚才，竟然是每年2500元年费的白金卡，omg!,0
我现在很慌，里面有将近20万,2
我的提还是，2个月了都，平安了挺快的,1
条码刚打的客服，说这张卡还没有正式发行，即使通过了，也不会收到卡片，出版坑不坑,0
恭喜，我老婆25000都两年多了提过没,1
成了私行能享受私行理财的收益吗哈哈,2
？就那么香么中行,1
mark，其实去卖掉招商的基金还是不错的,1
我有额度就没过，下款才查征信，有一点毛病就拒的Mathura你怀疑人生,0
侮辱我呢？固定临时只给一千块。尼玛的。找能客服吗是鬼浦发的真的？坑啊,0
我这么多年用卡经验，中信跟招商不在一个层次中信差太多了,0
你需要去柜台，明确告知柜员，帮忙修改一下信用卡系统的手机号码。把电话号码改成现在使用的，就可以咯。,2
我去年拒绝了今年也没敢申请,0
发卡片了去银行面签激活还能拒绝？,2
不错利率，可以撸,1
民生免息期最久最长才48天？,0
有的客服像不过脑子的，说话浦发的就是,0
过稳定性了很久，民生效率很低,0
这就难了，我的5000个葱卡平常真的给淘宝买个葱，别人呢,0
民用航空网申下卡7K。报送资料被拒，和同事一起申他批了2万，网申的卡，又让我去再度托柳的公章，网点还不想给开卡，幸好让我投诉了。结果1年到9K，2年不涨...,0
从批卡到开卡首刷然后第三天达标至少也要四五天，到时有没有就不一定了，不过活动还很长，小半年，就算没有也大概率会…心累,0
反正中信的你永远看不懂！,0
招商银行信用卡确实比中信银行信用卡好中信银行，又比交通银行信用卡好太多，最垃圾的是交通银行信用卡,0
招商。不想做就做不了。我没有那么多现金。立即兑现,0
先在App里面更新自己的住址和工作导致，然后再申请的时候务必和个人信息里面的地址保持一致。如果不通过，那就跟地址没关系了。...,2
扣款，就是固定额度，圆梦斤这些每个月在扣，你明天再问问，既然收了圆梦金的利息，凭什么不声不响就收回,0
银行利息还可以,1
羊卡吧young卡还是不错的,1
额度很优秀，不错。如果再申请，极好兴业和华夏都不错,1
见鬼了，建设银行10K都批不了,0
分期通是信用卡额度的三倍，你一万的信用卡额度那么分期通就是三万，等你什么时候看到分期通额度跟你信用卡额度不一样了，在试试提额。这也是我很早以前看到一个老哥发出来...,2
？？？这是哪个银行，有点坑人啊,0
小事儿能判刑8个月？属地化坑死人啊,0
我也周五申请的，你到了吗兴业的,2
找到了找回谢谢老哥平时压根就懒得去看中信的鸡肋活动,0
带发工资呢那的工资被扣了太惨了,0
兴业兴业一生黑,0
【建行支付白、旅行白】50K,2
听谁说的？没有这回事，我就一直申请一直爽！,1
兴业银行就很恶心。我找了上海银监局，兴业银行逗我裁撤再谈，结果我中套了,0
没有啊，就是就是指周六收到其他地方手机号打来说某些叫我还钱，不还就起诉了,0
那时手里还是张普卡，刷了两年不到三年额度就登顶。,1
手机银行支持？,2
超过90天，取消?新埃了,0
不要申二卡。我也以为申卡可以曲线，无奈不光没曲线提额，新卡片额度反而比之前的低。多了一个信用卡审批记录。真不如一开始就直接撸出调平！...,2
我是15500，他说现在不还就起诉我，网贷坑人啊,0
那些说取款消费时爽，还款时候绝望的回帖，这不是招商银行信用卡的锅，这是整个信用卡的构造！如果不能克制自己的消费欲望，那么可以考虑不办信用卡，而不是埋怨信用卡给自己带来绝望。,0
兴业是真坑准备还回完注销了,0
电话上帮说什么费率吗？我感觉是稳的，这个卡办是有你在下来银行的忙，银行在求你办呢,1
了玩币楼主吧？突然32800的收入。开心吧,1
拉卡拉还封顶啊？那不错啊，我也是20万，准备4万一刷，分两次刷出来。来不及出现什么难题吧？,1
卧槽这谁敢给你容许…脑子有水吧,0
我的中国银行也冻结5天了。完全没要解的意思。被ga冻结的,0
，房贷征信上能或许吧，查到房产证还能有些用，发票不一定能行，我首卡工行昨天也拒了，也想着重新去线下提供购房发票试试靠不住感觉有点有...,0
卧槽。我，月23申请没，现在完全没动静6这浦发的效率也是的谁了,0
谈谈心，分个万儿八千的就行，要求不高,2
什么卡种不说，明显也是没就去申请，不排除业务员忽悠,0
优惠这方面，小招一直不错的。搞“周三便利店五折活动的时候经常趁周三去711便利店薅5折优惠（每单5元封顶），每月可以薅...,1
有坑，和我没什么的网上申请自己区别,0
我有张浙江大学的，额度还挺高,1
请问这种鸡怎么截屏的啊，完全的搞不懂，心累,0
最近不幸的遭遇一次手机被盗，为了安全把所有银行卡换了一遍，其他所有银行二话不说都给我换了，唯独神经病一样的交行客服,0
啥记仇不记仇的??要是资质好??哪家银行都争着抢着要客户说白了还是自己不值钱??跟找工作一个道理我认为拒就一个原因自己不够幼稚??...,2
两家都是野鸡行，很强一定要选，那就留广发。,0
对，而且我不过还拒绝了。因为用不上他家储蓄卡,0
突然突然感觉招商看不起我,0
去年6能批，今年疫情开始就是4个点的良心利率不像好像中行中房贷的直接个点，。建行快贷容易套路。在一年有地方支用，最好的随意是就在有效期一年内的最后一天支用，都还...,1
牛车，我的车贷还完了,2
没黑，招商佛系，别刷小额太承揽多，招商不喜欢,0
现在那些那些机子扫码有积分啊,2
缺钱用这个，就是用了争取民生不提额，我申请了24，这个半年到一年还清期就当做装修贷吧,0
二星用户，狗日滴，啥时候并升，建行小姐姐,0
我存了3个月的砖??也秒左右拒??转到中行去了,0
祝下卡,2
？？？这是哪个银行，有点尖萼啊,0
0769我没有菩提?问了两个有中信卡的同事，今天既没有,2
的提示很温柔，建设还是可以这个,1
装修贷能贷多少？由什么决定的？还有能贷多少年,2
5行内要申请建设啊不然以后很难很难批卡,0
说没卡了，让办其他的，建行逗都,0
我不想逾期难道非要逾期才行啊,2
吓死我了分期付款，赶紧全部分期了，分了9了有期，就算降了也不至于缓不过来,0
优惠这方面，小招一直的。以前搞周三便利店五折”活动时候经常趁周三去711便利店薅招行5折优惠（每单5元封顶），每月可以薅两次。...,1
我去年9月份网申平安携程卡、卡员申广发犀利卡，秒批。,1
已经很不错了，多提两次就毕业了,1
靠??太坑了吧目前总授信32万??兴业4+1一提妥妥的??这下估计凉了害,0
看不起谁啊呢，提额这么难,0
这怎么搞？办个中国银行的信用卡就这么难么,0
你都试过啥协商??等我如果协商下来告诉你,2
我万年不提的容易姐昨天看了也提额度了,2
批次5k，用的是彩蛋，开心啊,1
我逾期4个月老哥你逾期多久上门边疆地区闭门不见应该没事吧怕去十二个老家那个地方就丢脸了妈的,0
中信拒绝合作每秒,0
大概15年买房的时候自己打印过征信，显示分期还剩多少，所以不知道你在哪里查的！有空我找找当时的征信拍...,2
交通联合确实牛批了。我这里地方银行六七年前就出过一款公交联名卡，把储蓄卡当公交卡用，一张卡，俩账户。公交账户和储蓄账户...,2
我确定是用自己的名字。你敢用别人的名字刷吗？不能吧,2
招行好，我的也是招行，光大被倒过一回也果断注销了！,1
看你聊天好累...需要钱就直接去网点，多问问题。,2
一般体制内企业、世界500强，中层干部以上。50万年薪加持。额度会低么,0
消费五笔免年费是每年都可以，还是就第一年？,2
看来冷冻对民生还是有点用的,0
当时办卡就搬了20砖，主要是100万的行驶证有作用，额度还是满意的,2
不好意思，没看你后边的逾期时间，楼主千万别轻生，你呢啊，只要你人在，就有希冀，赚钱还啊，我朋友杂货铺失败，银行贷款2.3百万还不上，家里房子都卖了，也不够还的，还...,0
申请被拒两次，第三次，50K名额,2
招商更为严重15天严重警告还款??封卡威胁,0
卡员上门一般极为靠谱,1
我中行房贷??首卡批4000??我说啥了??连销了几次??现在预审批都没了搞不好子系统记仇了??房贷现在都就11年了??这又搬了20砖??3个月之后是大象是马如此一来就知道了...,0
等收到领卡短信在就申请网点面签领卡一起办，额度去不会低,0
招商聚润用支付宝比较好,1
乌鲁木齐的吗？我也是啊，额度还是很失望的,1
我前几天去工行一代u盾升级到你发图的这个二代55元。。换张卡5元。。,2
季日均，这砖一个月就行了，开心，哈哈哈,1
欠了十五万看来就得给协商了，注销了以后再重新申请了只能，还有信用卡逾期还清了以后五年才能给办理房贷...,2
我想知道为什么我选择借出后不能进行下一步,2
从文字里老哥还是很潇洒的，羡慕能做自己的人,1
反正工商申了几次都拒了??其他行能下卡??能提额,2
广发首卡必选薅。返现给力方便。100我年犀利了4都了。一年1200,1
招行都换我5年还了。他废我黑屋怕他？？！,0
还有我觉得苏州银行都很多事，各种刁难外地人,0
不介意，反正我的建行就这个样子,2
我是信用卡的现金分期属于贷后,2
现在的你有消息了吗？我等的好焦虑啊,0
泪目啊，我2k的时候直接销了注销安心些,0
这都已经半个多月了，有的大佬说三天或者七天能自动解封，现在感觉遥遥无期,2
你们你这征信，难。。。养养再搞吧,0
中信每秒合作拒绝,0
信用卡支付0.01抽1～10元微信立减金，每月四次,2
不错卡面的,1
史上最无耻最闪烁的银行安全。之前用他家的卡他,0
直接网上申请。?民生普遍比较稳定，筹集的金额也不错,1
下卡难度还好吧，后面大半属实,0
是的我可以是这样感觉，资质也就能申请到不错的额度,1
我也是只差中行，一直不下来，养半年征信10月再战，人员申个中行卡好难,0
公司交社保或者公积金吗，交的话银行就知道，,2
垃圾招商银行。我是被拒了。隔壁民生开了张10万的。,0
没公积金??几乎推不倒老油子,2
本来是给你的。?刚给我卡的人跟我说最好刷别人的卡，然后拿现金,2
我原来都是直接取现出来的，特别方便,2
出去我18年协商现如今的也是一分不少，然后我就一直到现在没管了……坑不坑,0
去年这个时候看论坛民生满屏的提额，一年二连三连的动作一大片，忍不住网申东东了标白，秒批辅信三万，批卡倒是挺赞的，没能问题是一年了，临时现分都没见过，各种姿势用尽，除了没搬砖偶尔没接...,1
雪狼用着10家银行信用卡，觉得招商银行的信用卡app“掌上生活是”体验感最好的非常容易没有之一！其界面简洁，那么上手，也没有，多广告,1
办信用卡，除了四大国有银行（中国建设银行、工商银行、建行、建设银行），平安银行和招商银行也不错。,1
我半年内就一个查询，今天本来想申请的，没敢申，怕过不了，,0
平安不支持跨行控制台还款啊，这个不方便,0
我也是，秒拒，昨天刚点的，还选卡号选了半天，然后保护费芭比娃娃什么的全选了，还以为选了保护费还能有点机会，结果刚点完申请，还没退出手机银行，短信就来了直接秒拒...,2
你逾期多久了？,2
老哥，这个道理我都懂，就是难啊，家家有本难念的经。不知道还3个月最低能不能了，三个月能还上25000。,0
工行，六年了，现在还二十一万多由于是正式工，把我薪金卡锁了，怎么办？有类似的情况吗？,0
平安的我太坑别用，备用金提前还了扣了3%，打电话怼回来了,0
雪狼用着10家外资银行信用卡，觉得招商银行的信用卡app“掌上生存环境”是体验感最合适的，没有之一！其界面简洁，非常容易上手，也没有那么多广告,1
对，我是理想50k，满意了,1
红包是系统发的，只能分12期使用，月息2.1%。,2
别用普诺省，真坑,0
提额，恭喜，你说的哈哈到5000发帖的老哥就是我,1
平安是恶心，我听过贷款人员讲过，你这多个里，有5个是赚的,0
侮辱我呢？固定临时只外壁给一千块。尼玛的。能找客服吗？可鬼浦发的真的是坑啊,0
一年未提了，我想换交通银行，提的快,2
总要存钱，也就是坑钱。。这么坑,0
有能力就去网点，没能力就等，不用着急,2
面签很简单良民证就好首提一般半年咱俩下卡额度一样现在我5万多,2
额??这??和没协商没差别??我打算试试信访??管用的话告诉你，好心累啊,0
广发信用卡在弄免费办理，还送一箱AD钙，感觉是骗人的，有点怕是诈骗的,0
